<!--
This file is protected by Copyright. Please refer to the COPYRIGHT file 
distributed with this source distribution.

This file is part of REDHAWK core.

REDHAWK core is free software: you can redistribute it and/or modify it under 
the terms of the GNU Lesser General Public License as published by the Free 
Software Foundation, either version 3 of the License, or (at your option) any 
later version.

REDHAWK core is distributed in the hope that it will be useful, but WITHOUT ANY 
WARRANTY; without even the implied warranty of MERCHANTABILITY or FITNESS FOR 
A PARTICULAR PURPOSE.  See the GNU Lesser General Public License for more 
details.

You should have received a copy of the GNU Lesser General Public License along 
with this program.  If not, see http://www.gnu.org/licenses/.
-->

<!ELEMENT softpkg
      ( title?
	, author+
	, description?
	, propertyfile?
	, descriptor?
	, implementation+
	, usesdevice*
	)>
<!ATTLIST softpkg
	id		ID	#REQUIRED
	name		CDATA	#REQUIRED
	type		(sca_compliant | sca_non_compliant)  "sca_compliant"
	version	CDATA	#IMPLIED >

<!ELEMENT localfile EMPTY>
<!ATTLIST localfile
	name		CDATA	#REQUIRED>

<!ELEMENT propertyfile
	(localfile
	)>
<!ATTLIST propertyfile
	type		CDATA	#IMPLIED>

<!ELEMENT title (#PCDATA)>

<!ELEMENT pkgtype (#PCDATA)>

<!ELEMENT author 
	( name*
	, company?
	, webpage?
	)>

<!ELEMENT name (#PCDATA)>

<!ELEMENT company (#PCDATA)>

<!ELEMENT webpage (#PCDATA)>

<!ELEMENT description (#PCDATA)>

<!ELEMENT descriptor
	(localfile
	)>
<!ATTLIST descriptor
	name		CDATA	#IMPLIED>

<!ELEMENT implementation
	( description?
	, propertyfile?
	, code
	, compiler?
	, programminglanguage?
	, humanlanguage?
	, runtime?
	, ( os
	  | processor
	  | dependency
	  )+
	, usesdevice*
	)>

<!ATTLIST implementation
	id		ID	#REQUIRED
	aepcompliance (aep_compliant | aep_non_compliant) "aep_compliant">

<!ELEMENT code 
	( localfile
	, entrypoint?
	, stacksize?
	, priority?
	)>
<!ATTLIST code
	type		CDATA	#IMPLIED>

<!ELEMENT entrypoint (#PCDATA)>

<!ELEMENT stacksize (#PCDATA)>

<!ELEMENT priority (#PCDATA)>

<!ELEMENT compiler EMPTY>
<!ATTLIST compiler
	name		CDATA	#REQUIRED
	version 	CDATA	#IMPLIED>

<!ELEMENT programminglanguage EMPTY>
<!ATTLIST programminglanguage
	name		CDATA	#REQUIRED
	version	CDATA	#IMPLIED>

<!ELEMENT humanlanguage EMPTY>
<!ATTLIST humanlanguage
	name		CDATA	#REQUIRED >

<!ELEMENT os EMPTY>
<!ATTLIST os
	name		CDATA	#REQUIRED
	version	CDATA	#IMPLIED>

<!ELEMENT processor EMPTY>
<!ATTLIST processor
	name		CDATA	#REQUIRED>

<!ELEMENT dependency
	( softpkgref
	| propertyref
	| simpleref
	| simplesequenceref
	| structref
	| structsequenceref
	)>
<!ATTLIST dependency
	type		CDATA	#REQUIRED>

<!ELEMENT runtime EMPTY>
<!ATTLIST runtime
	name		CDATA	#REQUIRED
	version	CDATA	#IMPLIED>

<!ELEMENT propertyref EMPTY>
<!ATTLIST propertyref
	refid		CDATA	#REQUIRED
	value		CDATA	#REQUIRED>
	
<!ELEMENT softpkgref
	( localfile
	,  implref?
	)>

<!ELEMENT implref EMPTY>
<!ATTLIST implref 
	refid		CDATA	#REQUIRED>

<!ELEMENT  usesdevice
	( ( propertyref
	  | simpleref
	  | simplesequenceref
	  | structref
	  | structsequenceref
          )+
	)>
<!ATTLIST usesdevice
	id		ID	#REQUIRED
	type		CDATA	#REQUIRED>

<!ELEMENT simpleref EMPTY>
<!ATTLIST simpleref
	refid		CDATA	#REQUIRED
	value		CDATA	#REQUIRED>

<!-- REDHAWK extension: support any property type dependency -->		
<!ELEMENT simplesequenceref
	(values
	)>
<!ATTLIST simplesequenceref
	refid		CDATA	#REQUIRED>

<!ELEMENT structref
	(simpleref+        
	)>
<!ATTLIST structref
	refid		CDATA	#REQUIRED>

<!ELEMENT structsequenceref
	( structvalue+
	)>
<!ATTLIST structsequenceref
	refid		CDATA	#REQUIRED>

<!ELEMENT structvalue
	(simpleref+
	)>
		
<!ELEMENT values
	( value+ 
	)>
		
<!ELEMENT value (#PCDATA)>
