<?xml version="1.0" encoding="UTF-8"?>
<!DOCTYPE softpkg PUBLIC "-//JTRS//DTD SCA V2.2.2 SPD//EN" "softpkg.dtd">
<softpkg id="DCE:a14ae592-e293-48a5-b14c-a13105df6f5e" name="BasicService_cpp" type="2.1.0">
  <title></title>
  <author>
    <name>null</name>
  </author>
  <descriptor>
    <localfile name="BasicService_cpp.scd.xml"/>
  </descriptor>
  <implementation id="cpp">
    <description>The implementation contains descriptive information about the template for a software resource.</description>
    <code type="Executable">
      <localfile name="cpp/BasicService_cpp"/>
      <entrypoint>cpp/BasicService_cpp</entrypoint>
    </code>
    <compiler name="/usr/bin/gcc" version="4.4.7"/>
    <programminglanguage name="C++"/>
    <humanlanguage name="EN"/>
    <os name="Linux"/>
    <processor name="x86"/>
    <processor name="x86_64"/>
  </implementation>
</softpkg>
