<?xml version="1.0" encoding="UTF-8"?>
<!DOCTYPE softpkg PUBLIC "-//JTRS//DTD SCA V2.2.2 SPD//EN" "softpkg.dtd">
<softpkg id="DCE:d7791487-0dd1-4dea-bd3e-6ae3ff1ec7b7" name="math_py" type="2.0.9">
  <title></title>
  <author>
    <name>null</name>
  </author>
  <propertyfile type="PRF">
    <localfile name="math_py.prf.xml"/>
  </propertyfile>
  <descriptor>
    <localfile name="math_py.scd.xml"/>
  </descriptor>
  <implementation id="python">
    <description>The implementation contains descriptive information about the template for a software resource.</description>
    <code type="Executable">
      <localfile name="python"/>
      <entrypoint>python/math_py.py</entrypoint>
    </code>
    <programminglanguage name="Python"/>
    <humanlanguage name="EN"/>
    <runtime name="python" version="2.6.6"/>
    <os name="Linux"/>
    <dependency type="allocation">
      <propertyref refid="DCE:8dcef419-b440-4bcf-b893-cab79b6024fb" value="__MATH__(0.002,prop1,*)"/>
    </dependency>
  </implementation>
</softpkg>
