<?xml version="1.0" encoding="UTF-8"?>
<!--
This file is protected by Copyright. Please refer to the COPYRIGHT file
distributed with this source distribution.

This file is part of REDHAWK throughput.

REDHAWK throughput is free software: you can redistribute it and/or modify it under
the terms of the GNU Lesser General Public License as published by the Free
Software Foundation, either version 3 of the License, or (at your option) any
later version.

REDHAWK throughput is distributed in the hope that it will be useful, but WITHOUT ANY
WARRANTY; without even the implied warranty of MERCHANTABILITY or FITNESS FOR
A PARTICULAR PURPOSE.  See the GNU Lesser General Public License for more
details.

You should have received a copy of the GNU Lesser General Public License along
with this program.  If not, see http://www.gnu.org/licenses/.
-->
<!DOCTYPE softpkg PUBLIC "-//JTRS//DTD SCA V2.2.2 SPD//EN" "softpkg.dtd">
<softpkg id="DCE:4fd84907-be91-4331-bed5-b54e8ef4d81e" name="reader" type="sca_compliant">
  <title></title>
  <author>
    <name>null</name>
  </author>
  <propertyfile type="PRF">
    <localfile name="reader.prf.xml"/>
  </propertyfile>
  <descriptor>
    <localfile name="reader.scd.xml"/>
  </descriptor>
  <implementation id="cpp">
    <description>The implementation contains descriptive information about the template for a software component.</description>
    <code type="SharedLibrary">
      <localfile name="cpp/reader.so"/>
      <entrypoint>cpp/reader.so</entrypoint>
    </code>
    <compiler name="/usr/bin/gcc" version="4.1.2"/>
    <programminglanguage name="C++"/>
    <humanlanguage name="EN"/>
    <os name="Linux"/>
    <processor name="x86"/>
    <processor name="x86_64"/>
  </implementation>
</softpkg>
