<?xml version="1.0" encoding="UTF-8"?>
<!--
This file is protected by Copyright. Please refer to the COPYRIGHT file 
distributed with this source distribution.

This file is part of REDHAWK core.

REDHAWK core is free software: you can redistribute it and/or modify it under 
the terms of the GNU Lesser General Public License as published by the Free 
Software Foundation, either version 3 of the License, or (at your option) any 
later version.

REDHAWK core is distributed in the hope that it will be useful, but WITHOUT ANY 
WARRANTY; without even the implied warranty of MERCHANTABILITY or FITNESS FOR 
A PARTICULAR PURPOSE.  See the GNU Lesser General Public License for more 
details.

You should have received a copy of the GNU Lesser General Public License along 
with this program.  If not, see http://www.gnu.org/licenses/.
-->

<!DOCTYPE softpkg PUBLIC "-//JTRS//DTD SCA SPD V2.2.2//EN" "softpkg.dtd">
<softpkg id="DCE:2ef301e1-6c72-4386-a6da-da3d78d45937" name="FailStartup" type="sca_compliant">
  <title></title>
  <author>
    <name></name>
  </author>
  <propertyfile type="PRF">
    <localfile name="FailStartup.prf.xml"/>
  </propertyfile>
  <descriptor>
    <localfile name="FailStartup.scd.xml"/>
  </descriptor>
  <implementation id="DCE:c43af4d8-2750-4cd9-87ec-ae507fc30b30">
    <description>The implementation contains descriptive information about the template for a software component.</description>
    <code type="Executable">
      <localfile name="FailStartup.py"/>
      <entrypoint>FailStartup.py</entrypoint>
    </code>
    <programminglanguage name="Python"/>
    <humanlanguage name="EN"/>
    <runtime name="python" version="2.4.4"/>
    <os name="Linux"/>
    <processor name="x86"/>
    <dependency type="runtime_requirements">
	<!-- Consume mem capacity -->
	<propertyref refid="DCE:8dcef419-b440-4bcf-b893-cab79b6024fb" 
		     value="5000"/>
    </dependency>
    <dependency type="runtime_requirements">
	<!-- BogoMips capacity -->
	<propertyref refid="DCE:5636c210-0346-4df7-a5a3-8fd34c5540a8" value="1000"/>
    </dependency>
  </implementation>
</softpkg>
