<?xml version="1.0" encoding="UTF-8"?>
<!DOCTYPE softpkg PUBLIC "-//JTRS//DTD SCA V2.2.2 SPD//EN" "softpkg.dtd">
<softpkg id="DCE:a1b304c5-676f-4911-a042-f64105b58161" name="writeonly_java" type="2.1.2">
  <title></title>
  <author>
    <name>null</name>
  </author>
  <propertyfile type="PRF">
    <localfile name="writeonly_java.prf.xml"/>
  </propertyfile>
  <descriptor>
    <localfile name="writeonly_java.scd.xml"/>
  </descriptor>
  <implementation id="java">
    <description>The implementation contains descriptive information about the template for a software resource.</description>
    <code type="Executable">
      <localfile name="java"/>
      <entrypoint>java/startJava.sh</entrypoint>
    </code>
    <compiler name="/usr/bin/javac" version="1.7"/>
    <programminglanguage name="Java"/>
    <humanlanguage name="EN"/>
    <runtime name="/usr/bin/java" version="1.7"/>
    <os name="Linux"/>
  </implementation>
</softpkg>
