<?xml version="1.0" encoding="UTF-8"?>
<!--
This file is protected by Copyright. Please refer to the COPYRIGHT file 
distributed with this source distribution.

This file is part of REDHAWK core.

REDHAWK core is free software: you can redistribute it and/or modify it under 
the terms of the GNU Lesser General Public License as published by the Free 
Software Foundation, either version 3 of the License, or (at your option) any 
later version.

REDHAWK core is distributed in the hope that it will be useful, but WITHOUT ANY 
WARRANTY; without even the implied warranty of MERCHANTABILITY or FITNESS FOR 
A PARTICULAR PURPOSE.  See the GNU Lesser General Public License for more 
details.

You should have received a copy of the GNU Lesser General Public License along 
with this program.  If not, see http://www.gnu.org/licenses/.
-->

<!DOCTYPE softpkg PUBLIC "-//JTRS//DTD SCA V2.2.2 SPD//EN" "softpkg.dtd">
<softpkg id="DCE:588b1c4b-8c5b-4f56-a6c4-56ad28e2e47c" name="BasicTestDevice_java" type="sca_compliant">
  <title></title>
  <author>
    <name>null</name>
  </author>
  <propertyfile type="PRF">
    <localfile name="BasicTestDevice_java.prf.xml"/>
  </propertyfile>
  <descriptor>
    <localfile name="BasicTestDevice_java.scd.xml"/>
  </descriptor>
  <implementation id="java">
    <description>The implementation contains descriptive information about the template for a software component.</description>
    <code type="Executable">
      <localfile name="java"/>
      <entrypoint>java/startJava.sh</entrypoint>
    </code>
    <compiler name="/usr/bin/javac" version="1.5"/>
    <programminglanguage name="Java"/>
    <humanlanguage name="EN"/>
    <runtime name="/usr/bin/java" version="1.5"/>
    <os name="Linux"/>
  </implementation>
</softpkg>
