<?xml version="1.0" encoding="UTF-8"?>
<!DOCTYPE softpkg PUBLIC "-//JTRS//DTD SCA V2.2.2 SPD//EN" "softpkg.dtd">
<softpkg id="DCE:5042665c-5d33-40fe-a30f-f72d24dd56ba" name="BasicShared" type="sca_compliant">
  <title></title>
  <author>
    <name>null</name>
  </author>
  <propertyfile type="PRF">
    <localfile name="BasicShared.prf.xml"/>
  </propertyfile>
  <descriptor>
    <localfile name="BasicShared.scd.xml"/>
  </descriptor>
  <implementation id="cpp">
    <description>The implementation contains descriptive information about the template for a software resource.</description>
    <code type="SharedLibrary">
      <localfile name="cpp/BasicShared.so"/>
      <entrypoint>cpp/BasicShared.so</entrypoint>
    </code>
    <compiler name="/usr/bin/gcc" version="4.4.7"/>
    <programminglanguage name="C++"/>
    <humanlanguage name="EN"/>
    <os name="Linux"/>
    <processor name="x86"/>
    <processor name="x86_64"/>
  </implementation>
</softpkg>
