<?xml version="1.0" encoding="UTF-8"?>
<!DOCTYPE softpkg PUBLIC "-//JTRS//DTD SCA V2.2.2 SPD//EN" "softpkg.dtd">
<softpkg id="DCE:87ee8276-6814-4ebf-8f72-71bcf26baa10" name="log_test_py" type="2.1.3">
  <title></title>
  <author>
    <name>null</name>
  </author>
  <propertyfile type="PRF">
    <localfile name="log_test_py.prf.xml"/>
  </propertyfile>
  <descriptor>
    <localfile name="log_test_py.scd.xml"/>
  </descriptor>
  <implementation id="python">
    <description>The implementation contains descriptive information about the template for a software resource.</description>
    <code type="Executable">
      <localfile name="python"/>
      <entrypoint>python/log_test_py.py</entrypoint>
    </code>
    <programminglanguage name="Python"/>
    <humanlanguage name="EN"/>
    <runtime name="python" version="2.6.6"/>
    <os name="Linux"/>
  </implementation>
</softpkg>
