<?xml version="1.0" encoding="UTF-8"?>
<!DOCTYPE softpkg PUBLIC "-//JTRS//DTD SCA V2.2.2 SPD//EN" "softpkg.dtd">
<softpkg id="DCE:acae1b18-65c4-40ed-9534-caf5939b00a1" name="busycomp" type="2.1.1">
  <title></title>
  <author>
    <name>null</name>
  </author>
  <propertyfile type="PRF">
    <localfile name="busycomp.prf.xml"/>
  </propertyfile>
  <descriptor>
    <localfile name="busycomp.scd.xml"/>
  </descriptor>
  <implementation id="cpp">
    <description>The implementation contains descriptive information about the template for a software resource.</description>
    <code type="SharedLibrary">
      <localfile name="cpp/busycomp.so"/>
      <entrypoint>cpp/busycomp.so</entrypoint>
    </code>
    <compiler name="/usr/bin/gcc" version="4.4.7"/>
    <programminglanguage name="C++"/>
    <humanlanguage name="EN"/>
    <os name="Linux"/>
    <processor name="x86"/>
    <processor name="x86_64"/>
  </implementation>
</softpkg>
