<?xml version="1.0" encoding="UTF-8"?>
<!DOCTYPE softpkg PUBLIC "-//JTRS//DTD SCA V2.2.2 SPD//EN" "softpkg.dtd">
<softpkg id="DCE:6a3edaeb-7e2b-4438-b27e-ee7bf25b59f6" name="alloc_shm" type="2.1.3">
  <title></title>
  <author>
    <name>null</name>
  </author>
  <propertyfile type="PRF">
    <localfile name="alloc_shm.prf.xml"/>
  </propertyfile>
  <descriptor>
    <localfile name="alloc_shm.scd.xml"/>
  </descriptor>
  <implementation id="cpp">
    <description>The implementation contains descriptive information about the template for a software resource.</description>
    <code type="SharedLibrary">
      <localfile name="cpp/alloc_shm.so"/>
      <entrypoint>cpp/alloc_shm.so</entrypoint>
    </code>
    <compiler name="/usr/bin/gcc" version="4.4.7"/>
    <programminglanguage name="C++"/>
    <humanlanguage name="EN"/>
    <os name="Linux"/>
    <processor name="x86"/>
    <processor name="x86_64"/>
  </implementation>
</softpkg>