<?xml version="1.0" encoding="UTF-8"?>
<!--
This file is protected by Copyright. Please refer to the COPYRIGHT file
distributed with this source distribution.

This file is part of REDHAWK core.

REDHAWK core is free software: you can redistribute it and/or modify it under
the terms of the GNU Lesser General Public License as published by the Free
Software Foundation, either version 3 of the License, or (at your option) any
later version.

REDHAWK core is distributed in the hope that it will be useful, but WITHOUT ANY
WARRANTY; without even the implied warranty of MERCHANTABILITY or FITNESS FOR
A PARTICULAR PURPOSE.  See the GNU Lesser General Public License for more
details.

You should have received a copy of the GNU Lesser General Public License along
with this program.  If not, see http://www.gnu.org/licenses/.
-->
<!DOCTYPE softpkg PUBLIC "-//JTRS//DTD SCA V2.2.2 SPD//EN" "softpkg.dtd">
<softpkg id="DCE:db112b07-499f-4148-8768-934a6edec002" name="noop_mix_one" type="sca_compliant">
  <title></title>
  <author>
    <name>null</name>
  </author>
  <propertyfile type="PRF">
    <localfile name="noop_mix_one.prf.xml"/>
  </propertyfile>
  <descriptor>
    <localfile name="noop_mix_one.scd.xml"/>
  </descriptor>
  <implementation id="python">
    <description>The implementation contains descriptive information about the template for a software component.</description>
    <code type="Executable">
      <localfile name="python"/>
      <entrypoint>python/noop_mix_one.py</entrypoint>
    </code>
    <programminglanguage name="Python"/>
    <humanlanguage name="EN"/>
    <runtime name="python" version="2.4.4"/>
    <os name="Linux"/>
    <processor name="x86"/>
    <processor name="x86_64"/>
  </implementation>
</softpkg>
