<?xml version="1.0" encoding="UTF-8"?>
<!--
This file is protected by Copyright. Please refer to the COPYRIGHT file 
distributed with this source distribution.

This file is part of REDHAWK core.

REDHAWK core is free software: you can redistribute it and/or modify it under 
the terms of the GNU Lesser General Public License as published by the Free 
Software Foundation, either version 3 of the License, or (at your option) any 
later version.

REDHAWK core is distributed in the hope that it will be useful, but WITHOUT ANY 
WARRANTY; without even the implied warranty of MERCHANTABILITY or FITNESS FOR 
A PARTICULAR PURPOSE.  See the GNU Lesser General Public License for more 
details.

You should have received a copy of the GNU Lesser General Public License along 
with this program.  If not, see http://www.gnu.org/licenses/.
-->

<!DOCTYPE softpkg PUBLIC "-//JTRS//DTD SCA V2.2.2 SPD//EN" "softpkg.dtd">
<softpkg id="DCE:2d7109e7-2e81-4ff5-b139-b79076b1653e" name="ServiceComponent" type="sca_compliant">
  <title></title>
  <author>
    <name>null</name>
  </author>
  <propertyfile type="PRF">
    <localfile name="ServiceComponent.prf.xml"/>
  </propertyfile>
  <descriptor>
    <localfile name="ServiceComponent.scd.xml"/>
  </descriptor>
  <implementation id="python">
    <description>The implementation contains descriptive information about the template for a software component.</description>
    <code type="Executable">
      <localfile name="python"/>
      <entrypoint>python/ServiceComponent.py</entrypoint>
    </code>
    <programminglanguage name="Python"/>
    <humanlanguage name="EN"/>
    <runtime name="python" version="2.4.4"/>
    <os name="Linux"/>
  </implementation>
</softpkg>
