<?xml version="1.0" encoding="UTF-8"?>
<!DOCTYPE softpkg PUBLIC "-//JTRS//DTD SCA V2.2.2 SPD//EN" "softpkg.dtd">
<softpkg id="DCE:b1ee1f27-45bd-4733-9905-2cc622146167" name="slow_stop_cpp" type="2.0.9">
  <title></title>
  <author>
    <name>null</name>
  </author>
  <propertyfile type="PRF">
    <localfile name="slow_stop_cpp.prf.xml"/>
  </propertyfile>
  <descriptor>
    <localfile name="slow_stop_cpp.scd.xml"/>
  </descriptor>
  <implementation id="cpp">
    <description>The implementation contains descriptive information about the template for a software resource.</description>
    <code type="Executable">
      <localfile name="cpp/slow_stop_cpp"/>
      <entrypoint>cpp/slow_stop_cpp</entrypoint>
    </code>
    <compiler name="/usr/bin/gcc" version="4.4.7"/>
    <programminglanguage name="C++"/>
    <humanlanguage name="EN"/>
    <os name="Linux"/>
    <processor name="x86"/>
    <processor name="x86_64"/>
  </implementation>
</softpkg>
