<?xml version="1.0" encoding="UTF-8"?>
<!DOCTYPE softpkg PUBLIC "-//JTRS//DTD SCA V2.2.2 SPD//EN" "softpkg.dtd">
<softpkg id="DCE:18d37976-41a1-45b6-88c3-aa412857dbc6" name="rf_ctrl" type="2.1.3">
  <title></title>
  <author>
    <name>null</name>
  </author>
  <propertyfile type="PRF">
    <localfile name="rf_ctrl.prf.xml"/>
  </propertyfile>
  <descriptor>
    <localfile name="rf_ctrl.scd.xml"/>
  </descriptor>
  <implementation id="cpp">
    <description>The implementation contains descriptive information about the template for a software resource.</description>
    <code type="SharedLibrary">
      <localfile name="cpp/rf_ctrl.so"/>
      <entrypoint>cpp/rf_ctrl.so</entrypoint>
    </code>
    <compiler name="/usr/bin/gcc" version="4.4.7"/>
    <programminglanguage name="C++"/>
    <humanlanguage name="EN"/>
    <os name="Linux"/>
    <processor name="x86"/>
    <processor name="x86_64"/>
  </implementation>
  <implementation id="java">
    <description>The implementation contains descriptive information about the template for a software resource.</description>
    <code type="Executable">
      <localfile name="java"/>
      <entrypoint>java/startJava.sh</entrypoint>
    </code>
    <compiler name="/usr/bin/javac" version="1.7"/>
    <programminglanguage name="Java"/>
    <humanlanguage name="EN"/>
    <runtime name="/usr/bin/java" version="1.7"/>
    <os name="Linux"/>
  </implementation>
  <implementation id="python">
    <description>The implementation contains descriptive information about the template for a software resource.</description>
    <code type="Executable">
      <localfile name="python"/>
      <entrypoint>python/rf_ctrl.py</entrypoint>
    </code>
    <programminglanguage name="Python"/>
    <humanlanguage name="EN"/>
    <runtime name="python" version="2.6.6"/>
    <os name="Linux"/>
  </implementation>
</softpkg>
