<?xml version="1.0" encoding="UTF-8"?>
<!DOCTYPE softpkg PUBLIC "-//JTRS//DTD SCA V2.2.2 SPD//EN" "softpkg.dtd">
<softpkg id="DCE:589206b6-6283-4088-8b40-50c5bd263650" name="S2" type="2.0.4">
  <title></title>
  <author>
    <name>null</name>
  </author>
  <propertyfile>
    <localfile name="S2.prf.xml"/>
  </propertyfile>
  <descriptor>
    <localfile name="S2.scd.xml"/>
  </descriptor>
  <implementation id="python">
    <description>The implementation contains descriptive information about the template for a software component.</description>
    <code type="Executable">
      <localfile name="python"/>
      <entrypoint>python/S2.py</entrypoint>
    </code>
    <programminglanguage name="Python"/>
    <humanlanguage name="EN"/>
    <runtime name="python" version="2.6.6"/>
    <os name="Linux"/>
  </implementation>
</softpkg>
