<?xml version="1.0" encoding="UTF-8"?>
<!DOCTYPE softpkg PUBLIC "-//JTRS//DTD SCA V2.2.2 SPD//EN" "softpkg.dtd">
<softpkg id="DCE:52155a6d-0693-49fe-81cf-4e39db4722aa" name="cpp_with_deps" type="2.0.0">
  <title></title>
  <author>
    <name>null</name>
  </author>
  <propertyfile type="PRF">
    <localfile name="cpp_with_deps.prf.xml"/>
  </propertyfile>
  <descriptor>
    <localfile name="cpp_with_deps.scd.xml"/>
  </descriptor>
  <implementation id="cpp">
    <description>The implementation contains descriptive information about the template for a software component.</description>
    <code type="Executable">
      <localfile name="cpp/cpp_with_deps"/>
      <entrypoint>cpp/cpp_with_deps</entrypoint>
    </code>
    <compiler name="/usr/bin/gcc" version="4.4.7"/>
    <programminglanguage name="C++"/>
    <humanlanguage name="EN"/>
    <os name="Linux"/>
    <processor name="x86"/>
    <processor name="x86_64"/>
    <dependency type="required">
      <softpkgref>
        <localfile name="/deps/cpp_dep1/cpp_dep1.spd.xml"/>
      </softpkgref>
    </dependency>
  </implementation>
</softpkg>
