<?xml version="1.0" encoding="UTF-8"?>
<!DOCTYPE softpkg PUBLIC "-//JTRS//DTD SCA V2.2.2 SPD//EN" "softpkg.dtd">
<softpkg id="DCE:8e079bfe-9c3e-48cc-b5e4-dc74f7461171" name="time_py_now" type="sca_compliant">
  <title></title>
  <author>
    <name>null</name>
  </author>
  <propertyfile type="PRF">
    <localfile name="time_py_now.prf.xml"/>
  </propertyfile>
  <descriptor>
    <localfile name="time_py_now.scd.xml"/>
  </descriptor>
  <implementation id="python">
    <description>The implementation contains descriptive information about the template for a software resource.</description>
    <code type="Executable">
      <localfile name="python"/>
      <entrypoint>python/time_py_now.py</entrypoint>
    </code>
    <programminglanguage name="Python"/>
    <humanlanguage name="EN"/>
    <runtime name="python" version="2.6.6"/>
    <os name="Linux"/>
  </implementation>
</softpkg>
